{
  "schema_version": "1.0",
  "project": "NFRA_COMPEFFICACY",
  "round": 4,
  "seat": "3.0.0_SA_CVO",
  "written_utc": "2026-09-03T09:27:00Z",
  "trigger": "the round-4 L10 slug (S13 + S14 GRADUATED in org/missions/D11/NFRA/NFRA_COMPEFFICACY/surprise-channel/investigations/INVESTIGATION_v1.md and their route rows in .../remediations/REMEDIATION_v1.md, both @153522a509)",
  "rows": [
    {"seq": 1, "limb": "L9", "started_utc": "2026-09-03T08:15Z", "ended_utc": "2026-09-03T08:19Z",
     "act": "Dispositioned S10 (the rollup's `adjudicates` blindness, a round-3 item) on its disarm owner's report: verified 2bc3679e0b in HEAD's history, exercised the fixed rollup from this seat (project open 5 -> 1 -> 0 after S12; S1/S6 `_latest` DISMISSED; estate open 73 -> 70 -> 69; NFRA_CLDGRPH's 8 genuinely open rows unchanged as the negative control); appended S12 adjudicating S10 DISMISSED_WITH_REASON",
     "inputs": [{"kind": "MESSAGE", "ref": "93349"}, {"kind": "ARTIFACT", "ref": ".tools/comp-surprise.py@2bc3679e0b"}],
     "outputs": [{"kind": "ARTIFACT", "ref": "org/missions/D11/NFRA/NFRA_COMPEFFICACY/surprise-channel/investigations/INVESTIGATION_v1.md@b1dbe2ab26"}, {"kind": "MESSAGE", "ref": "93358"}, {"kind": "MESSAGE", "ref": "93359"}, {"kind": "MESSAGE", "ref": "93360"}],
     "spine_clause": "L9 disposition as a new row citing the old id; 1.0.0_SA_CTO 93320 limb (i) -- disarmed in place by the owner within lane, dispositioned by the CVO",
     "gate_or_notifier_touched": "jsonschema VALID before commit; surprise-row-gate 1 new row of 12; the notifier emitted S12 (INERT)",
     "note": "the one message went to three seats by to_agents with per-recipient receipts; the 93341 subtract-five instruction withdrawn in it"},
    {"seq": 2, "limb": "X", "started_utc": "2026-09-03T08:20Z", "ended_utc": "2026-09-03T09:08Z",
     "act": "Held at L8 through round 4's L6-L7. Read NFRA_CLDGRPH's rows S9-S12 and its round-1 slug as the notifier delivered them (none names this seat; two in-place-mutation warnings were that seat's own uncommitted redo, confirmed by 93395 and by S9/S11 being absent from HEAD at the read). Read ADVI_INSURE-S12 (a flat-register project with no lane team; base L8) and positive-controlled its claimed same-turn disarm message to the COO after a first listing false-zeroed on a tilde in the filename",
     "inputs": [{"kind": "MESSAGE", "ref": "93395"}, {"kind": "ARTIFACT", "ref": "org/surprise_channel/ADVI_INSURE/INVESTIGATION_v1.md@a432f0b6de"}],
     "outputs": [],
     "spine_clause": "L8 intake over both roots; a row on another project's channel is read, never dispositioned, by this seat",
     "note": "the filename trap saved to this seat's memory; nothing owed on either channel"},
    {"seq": 3, "limb": "L8", "started_utc": "2026-09-03T09:08Z", "ended_utc": "2026-09-03T09:20Z",
     "act": "Read the round's end state on the record, never from the report: nine task orders' status tags at HEAD c6d4eced8f (7 complete, 2 WITHDRAWN, 0 pending); both round-4 instances through proof-of-spec-check at this seat, first at 7e78fe9171 + 6 uncommitted lines and again at the clean 7b649df39d (VALID rc 0, 6 of 6 each, surprises 0; the dirty lines touched only multi-token cell_refs, which neither instance has); the channel at HEAD (12 rows, all dispositioned; rollup 0 open / 0 armed); the deliverables' own findings arrays (T-9 F1-F3, T-7 F1-F4) and answer_state blocks; the proof rows' status_reasons; the decomposition's rows CE-t-6/7/9/19 and CE-tp-1 verbatim; PRD s.4.3 :382-399 and s.4.4 :416-471 at full width; the CTO's 93320 and 93425",
     "inputs": [{"kind": "MESSAGE", "ref": "93421"}, {"kind": "MESSAGE", "ref": "93425"}, {"kind": "ARTIFACT", "ref": "org/missions/D11/NFRA/NFRA_COMPEFFICACY/deliverables/0.8.0_AE_CloudComp/NFRA_COMPEFFICACY.TO-CE-T-9.comp-trigger-s4-audit.proof_of_spec.json@b1dab0b6a0"}, {"kind": "ARTIFACT", "ref": "org/missions/D11/NFRA/NFRA_COMPEFFICACY/deliverables/0.8.0_AE_CloudComp~A/NFRA_COMPEFFICACY.TO-CE-T-7.comp-dataflow-s4-audit.proof_of_spec.json@803539f490"}, {"kind": "ARTIFACT", "ref": "org/missions/D11/NFRA/NFRA_COMPEFFICACY/prd/NFRA_COMPEFFICACY_PRD.md@19bf1c7322 s.4.3, s.4.4"}, {"kind": "ARTIFACT", "ref": "org/missions/D11/NFRA/NFRA_COMPEFFICACY/decompositions/NFRA_COMPEFFICACY_DECOMP.md@b7daeaa6f0"}],
     "outputs": [{"kind": "GATE_OUTPUT", "ref": "proof-of-spec-check.py: VALID (rc=0) x2 at 7b649df39d; artifacts 2 resolved + 1 co-committed (T-9), 2 + 2 (T-7); surprises 0, 0"}],
     "spine_clause": "L8 compilation; L10 precondition read (task-order half with valid proof instances; dispositioned half by the latest carrier)",
     "note": "the checker itself was a dirty worktree file at the first read and a committed one at the second -- both vintages stated"},
    {"seq": 4, "limb": "L9", "started_utc": "2026-09-03T09:12Z", "ended_utc": "2026-09-03T09:20Z",
     "act": "Two adjudications against the spec's own text. (a) T9-AC2: the face asks four distinguishable outputs; PRD s.4.3 makes any two alike a FAIL and names it FWD-2; the deliverable records three of four planted cases byte-identical; the instance self-marks PASS on its second clause -- GRADUATED, the remedy is an order under a cell the decomposition contains (CE-t-9; CE-t-6 read as comp-blast's own row, not a cross-tool home). (b) T7-F4: s.4.4 fixes rc 0 at expiry with no archetype clause; comp-dataflow's gate binds rc to the verdict; a budget-cut sweep returns CLEAN -- GRADUATED, the remedy needs an outcome the PRD does not name. (c) The round-3 placement of T-3 F2 under CE-t-6 found wrong on the same read; corrected in the stamp section, scoped to that clause. The other findings read and not counted (per-tool carrier), F2 of T-7 and F3 of T-9 named for the L4 owner",
     "inputs": [{"kind": "ARTIFACT", "ref": "org/missions/D11/NFRA/NFRA_COMPEFFICACY/deliverables/0.8.0_AE_CloudComp/comp-trigger.result.md@b1dab0b6a0"}, {"kind": "ARTIFACT", "ref": "org/missions/D11/NFRA/NFRA_COMPEFFICACY/deliverables/0.8.0_AE_CloudComp~A/comp-dataflow.result.md@803539f490"}, {"kind": "MESSAGE", "ref": "93320"}],
     "outputs": [],
     "spine_clause": "L9 grounding bar (annex s.2); the route enum's one question (93320): what does the remedy need that does not exist yet in this project's chain",
     "note": "the S9 precedent (findings inside a deliverable are not rows) was never about a finding that contradicts the TO's own criterion; S13 is the first such row"},
    {"seq": 5, "limb": "L10", "started_utc": "2026-09-03T09:20Z", "ended_utc": "2026-09-03T09:24Z",
     "act": "The slug: S13 and S14 appended GRADUATED (spec_asserts / world_is / grounding each) with the 'L10 stamp -- round 4' section (precondition table, the two routes, the read-and-not-counted list, the scoped correction); REMEDIATION_v1.md opened with the two route rows (S13 SPEC_ERROR -> 6, owner 2.0.0_SA_COO; S14 SCOPE_CHANGE, REQUIRES_UNNAMED_OUTCOME, outcome_ref null, -> 2, owner 1.0.0_SA_CTO, proposed outcome in plain English); ONE commit so the gate's census admits the routes; rollup after: open 0, armed 2 (graduated, not yet disarmed); push state measured; the stamped rows handed to their route owners, a record line to the integrator",
     "inputs": [{"kind": "ARTIFACT", "ref": "org/missions/D11/NFRA/NFRA_COMPEFFICACY/surprise-channel/investigations/INVESTIGATION_v1.md@b1dbe2ab26"}, {"kind": "RECORD", "ref": "org/surprise_channel/schemas/remediation_row.schema.json (worktree, the route/loop_target/scope_change_kind contract)"}, {"kind": "ARTIFACT", "ref": "org/missions/D0/NFRA/NFRA_CLDGRPH/surprise-channel/remediations/REMEDIATION_v1.md@59af3f1df5 (the form template)"}],
     "outputs": [{"kind": "ARTIFACT", "ref": "org/missions/D11/NFRA/NFRA_COMPEFFICACY/surprise-channel/investigations/INVESTIGATION_v1.md@153522a509"}, {"kind": "ARTIFACT", "ref": "org/missions/D11/NFRA/NFRA_COMPEFFICACY/surprise-channel/remediations/REMEDIATION_v1.md@153522a509"}, {"kind": "MESSAGE", "ref": "93439"}, {"kind": "MESSAGE", "ref": "93440"}, {"kind": "MESSAGE", "ref": "93441"}],
     "spine_clause": "L9 output as one slug at L10 (annex s.5, s.8); the stamped rows to the route owners and to no one else (s.8 'Who acts': 2.0.0_SA_COO for 6, 1.0.0_SA_CTO for 2)",
     "gate_or_notifier_touched": "jsonschema VALID on all four rows before commit; surprise-row-gate 2 new of 14 (investigation) + 'L10 precondition ... 9 task order(s) at HEAD on both roots, 0 open; 14 investigation item(s) ... 0 undispositioned; route admitted' x2 (remediation); missions-tree-check 0; the notifier emitted S13/S14 on both files",
     "note": "message ids read from the delivered files' Msg-ID headers (93439 COO, 93440 CTO, 93441 MSTR), never guessed; push state: origin/CLOUD @3bd8d2ef04 by ls-remote at 09:22:38Z, 153522a509 LOCAL, ahead 63 across seats"},
    {"seq": 6, "limb": "X", "started_utc": "2026-09-03T09:26Z", "ended_utc": "2026-09-03T09:28Z",
     "act": "This step log",
     "inputs": [{"kind": "WORD", "ref": "org/tier1_exec/2.0.0_SA_COO/deliverables/ANDREW_DIRECT_20260903_042xZ_PER_AGENT_STEP_LOGS_INPUT_OUTPUT_FOR_CTO_LOOP_COMPILATION.md@bcc26d2691"}],
     "outputs": [],
     "spine_clause": "NONE (a log)",
     "note": "the compilation is the CTO's"}
  ]
}
